{
  "totalRecords": 150,
  "meta": {
    "generatedAt": "2026-03-23T10:30:00Z",
    "source": "audit_schedule_compliance_data"
  },
  "complianceBuckets": {
    "description": "Low-performing auditees grouped into compliance percentage buckets (0–15%, 15–25%, 25–50%), showing auditee count per occupied bucket.",
    "buckets": [
      {
        "bucketLabel": "0–15%",
        "bucketMin": 0,
        "bucketMax": 15,
        "auditeeCount": 1
      },
      {
        "bucketLabel": "15–25%",
        "bucketMin": 15,
        "bucketMax": 25,
        "auditeeCount": 1
      },
      {
        "bucketLabel": "25–50%",
        "bucketMin": 25,
        "bucketMax": 50,
        "auditeeCount": 1
      }
    ]
  },
  "top3OverallLowPerformers": {
    "description": "Top 3 auditees with the absolute lowest achieved compliance percentage across all low-compliance buckets combined, sorted ascending by achievedPercentage.",
    "items": [
      {
        "auditeeName": "Kolkata Downtown Branch",
        "achievedPercentage": 8.5
      }
    ]
  },
  "zoneComplianceOverview": {
    "description": "Count of audits per zone where Achieved Percentage < 50%, sorted by count descending.",
    "lowComplianceThreshold": 50,
    "zones": [
      {
        "zoneName": "West Zone",
        "lowComplianceAuditCount": 12
      },
      {
        "zoneName": "North Zone",
        "lowComplianceAuditCount": 9
      },
      {
        "zoneName": "East Zone",
        "lowComplianceAuditCount": 6
      },
      {
        "zoneName": "South Zone",
        "lowComplianceAuditCount": 3
      },
      {
        "zoneName": "Central Zone",
        "lowComplianceAuditCount": 1
      }
    ]
  }
}