{
  "totalRecords": 85,
  "meta": {
    "generatedAt": "2026-03-23T00:00:00Z",
    "source": "audit_schedule_compliance_data"
  },
  "complianceBuckets": {
    "description": "Low-performing auditees grouped into compliance percentage buckets (0–15%, 15–25%, 25–50%), showing auditee count per occupied bucket.",
    "buckets": [
      {
        "bucketLabel": "25–50%",
        "bucketMin": 25,
        "bucketMax": 50,
        "auditeeCount": 3
      }
    ]
  },
  "top3OverallLowPerformers": {
    "description": "Top 3 auditees with the absolute lowest achieved compliance percentage across all low-compliance buckets combined, sorted ascending by achievedPercentage.",
    "items": [
      {
        "auditeeName": "Mumbai Metro Audit",
        "achievedPercentage": 28.5
      },
      {
        "auditeeName": "Delhi Central Office",
        "achievedPercentage": 35.1
      },
      {
        "auditeeName": "Chennai North Branch",
        "achievedPercentage": 42.7
      }
    ]
  },
  "zoneComplianceOverview": {
    "description": "Count of audits per zone where Achieved Percentage < 50%, sorted by count descending.",
    "lowComplianceThreshold": 50,
    "zones": [
      {
        "zoneName": "North Zone",
        "lowComplianceAuditCount": 12
      },
      {
        "zoneName": "West Zone",
        "lowComplianceAuditCount": 8
      },
      {
        "zoneName": "South Zone",
        "lowComplianceAuditCount": 5
      }
    ]
  }
}